{
  "v": "2",
  "event": "ask",
  "correlation_id": "550e8400-e29b-41d4-a716-446655440002",
  "sender": "dispatcher",
  "target": "worker-node",
  "timestamp": "2026-09-27T13:05:00-05:00",
  "message": "Summarize the attached brief",
  "payload": {
    "task": "summarize",
    "priority": "normal",
    "constraints": {
      "max_tokens": 500,
      "format": "bullets"
    }
  }
}
